{
  "length_px": 1320,
  "kind": "fixed",
  "extra_rest_ticks": 1,
  "placements": [
    { "at_px": 120, "type": "meteorite", "x": 86, "variant": "medium" },
    { "at_px": 120, "type": "fireball", "x": 34, "variant": "small" },
    { "at_px": 130, "type": "meteorite", "x": 222, "variant": "medium" },
    { "at_px": 140, "type": "meteorite", "x": 383, "variant": "medium" },
    { "at_px": 150, "type": "meteorite", "x": 279, "variant": "big" },
    { "at_px": 160, "type": "meteorite", "x": 143, "variant": "big" },
    { "at_px": 180, "type": "meteorite", "x": 566, "variant": "small" },
    { "at_px": 190, "type": "meteorite", "x": 338, "variant": "small" },
    { "at_px": 230, "type": "meteorite", "x": 490, "variant": "small" },
    { "at_px": 230, "type": "coin", "x": 328, "y": 2, "variant": "common" },
    { "at_px": 230, "type": "fireball", "x": 638, "variant": "big", "invert": true },
    { "at_px": 230, "type": "fireball", "x": 0, "variant": "small" },
    { "at_px": 260, "type": "fireball", "x": 214, "variant": "small" },
    { "at_px": 260, "type": "fireball", "x": 149, "variant": "small" },
    { "at_px": 300, "type": "fireball", "x": 490, "variant": "small", "invert": true },
    { "at_px": 320, "type": "fireball", "x": 471, "variant": "big", "invert": true },
    { "at_px": 500, "type": "fireball", "x": 75, "variant": "small" },
    { "at_px": 600, "type": "fireball", "x": 205, "variant": "small" },
    { "at_px": 610, "type": "fireball", "x": 535, "variant": "big" },
    { "at_px": 650, "type": "fireball", "x": 305, "variant": "small" },
    { "at_px": 700, "type": "fireball", "x": 108, "variant": "small" },
    { "at_px": 700, "type": "fireball", "x": 637, "variant": "big", "invert": true },
    { "at_px": 710, "type": "fireball", "x": 329, "variant": "big", "invert": true },
    { "at_px": 750, "type": "fireball", "x": 452, "variant": "small", "invert": true },
    { "at_px": 750, "type": "fireball", "x": 401, "variant": "big", "invert": true },
    { "at_px": 790, "type": "fireball", "x": 217, "variant": "small" },
    { "at_px": 870, "type": "fireball", "x": 4, "variant": "small" },
    { "at_px": 910, "type": "meteorite", "x": 273, "variant": "medium" },
    { "at_px": 910, "type": "meteorite", "x": 144, "variant": "big" },
    { "at_px": 910, "type": "meteorite", "x": 384, "variant": "big" },
    { "at_px": 910, "type": "coin", "x": 541, "y": 0, "variant": "common" },
    { "at_px": 940, "type": "fireball", "x": 316, "variant": "big" },
    { "at_px": 950, "type": "fireball", "x": 85, "variant": "small" },
    { "at_px": 960, "type": "meteorite", "x": 360, "variant": "medium" },
    { "at_px": 960, "type": "fireball", "x": 346, "variant": "small" },
    { "at_px": 1010, "type": "meteorite", "x": 414, "variant": "small" },
    { "at_px": 1040, "type": "meteorite", "x": 500, "variant": "medium" },
    { "at_px": 1040, "type": "meteorite", "x": 575, "variant": "medium" },
    { "at_px": 1040, "type": "fireball", "x": 264, "variant": "small" },
    { "at_px": 1040, "type": "fireball", "x": 199, "variant": "small" },
    { "at_px": 1040, "type": "fireball", "x": 93, "variant": "small" },
    { "at_px": 1080, "type": "meteorite", "x": 46, "variant": "small" },
    { "at_px": 1080, "type": "meteorite", "x": 208, "variant": "small" },
    { "at_px": 1080, "type": "meteorite", "x": 354, "variant": "small" },
    { "at_px": 1120, "type": "fireball", "x": 234, "variant": "small" }
  ]
}
