{
  "length_px": 1000,
  "kind": "pool",
  "min_level": 2,
  "placements": [
    { "at_px": 120, "type": "coin", "x": 357, "y": 2, "variant": "rare" },
    { "at_px": 130, "type": "satellite", "y": 459, "variant": "flat" },
    { "at_px": 130, "type": "satellite", "y": 239, "variant": "flat" },
    { "at_px": 130, "type": "satellite", "y": 39, "variant": "flat" },
    { "at_px": 140, "type": "satellite", "y": 121, "variant": "flat", "invert": true },
    { "at_px": 140, "type": "satellite", "y": 317, "variant": "flat", "invert": true },
    { "at_px": 150, "type": "satellite", "y": 447, "variant": "flat", "invert": true },
    { "at_px": 150, "type": "satellite", "y": 40, "variant": "angled", "invert": true },
    { "at_px": 150, "type": "satellite", "y": 204, "variant": "angled", "invert": true },
    { "at_px": 150, "type": "satellite", "y": 367, "variant": "angled", "invert": true },
    { "at_px": 160, "type": "satellite", "y": 85, "variant": "angled" },
    { "at_px": 160, "type": "satellite", "y": 205, "variant": "angled" },
    { "at_px": 160, "type": "satellite", "y": 355, "variant": "angled" },
    { "at_px": 170, "type": "satellite", "y": 139, "variant": "flat" },
    { "at_px": 170, "type": "satellite", "y": 425, "variant": "flat" },
    { "at_px": 190, "type": "satellite", "y": 289, "variant": "flat" },
    { "at_px": 200, "type": "satellite", "y": 309, "variant": "flat" },
    { "at_px": 210, "type": "satellite", "y": 223, "variant": "flat", "invert": true },
    { "at_px": 210, "type": "satellite", "y": 82, "variant": "flat", "invert": true },
    { "at_px": 220, "type": "satellite", "y": 175, "variant": "flat" },
    { "at_px": 240, "type": "satellite", "y": 308, "variant": "flat", "invert": true },
    { "at_px": 240, "type": "satellite", "y": 115, "variant": "angled" },
    { "at_px": 260, "type": "satellite", "y": 291, "variant": "angled", "invert": true },
    { "at_px": 270, "type": "satellite", "y": 72, "variant": "angled", "invert": true },
    { "at_px": 280, "type": "satellite", "y": 146, "variant": "angled", "invert": true },
    { "at_px": 280, "type": "satellite", "y": 147, "variant": "angled" },
    { "at_px": 300, "type": "satellite", "y": 106, "variant": "angled", "invert": true },
    { "at_px": 310, "type": "satellite", "y": 318, "variant": "angled" },
    { "at_px": 320, "type": "satellite", "y": 264, "variant": "flat" },
    { "at_px": 330, "type": "satellite", "y": 184, "variant": "flat" },
    { "at_px": 340, "type": "satellite", "y": 450, "variant": "flat" },
    { "at_px": 350, "type": "satellite", "y": 54, "variant": "flat" },
    { "at_px": 360, "type": "satellite", "y": 402, "variant": "flat", "invert": true },
    { "at_px": 370, "type": "satellite", "y": 204, "variant": "flat", "invert": true },
    { "at_px": 380, "type": "satellite", "y": 320, "variant": "flat", "invert": true },
    { "at_px": 450, "type": "satellite", "y": 382, "variant": "flat", "invert": true },
    { "at_px": 450, "type": "satellite", "y": 223, "variant": "flat", "invert": true },
    { "at_px": 450, "type": "satellite", "y": 83, "variant": "flat", "invert": true },
    { "at_px": 450, "type": "coin", "x": 100, "y": 0, "variant": "common" },
    { "at_px": 640, "type": "satellite", "y": 53, "variant": "angled", "invert": true },
    { "at_px": 640, "type": "satellite", "y": 42, "variant": "angled" },
    { "at_px": 720, "type": "satellite", "y": 171, "variant": "angled", "invert": true },
    { "at_px": 740, "type": "satellite", "y": 256, "variant": "angled" }
  ]
}
