{
  "length_px": 1200,
  "kind": "fixed",
  "extra_rest_ticks": 0,
  "placements": [
    { "at_px": 120, "type": "meteorite", "x": 452, "variant": "big" },
    { "at_px": 120, "type": "meteorite", "x": 565, "variant": "big" },
    { "at_px": 132, "type": "meteorite", "x": 320, "variant": "medium" },
    { "at_px": 260, "type": "coin", "x": 450, "variant": "common" },
    { "at_px": 290, "type": "coin", "x": 420, "variant": "common" },
    { "at_px": 300, "type": "meteorite", "x": 120, "variant": "big" },
    { "at_px": 300, "type": "meteorite", "x": 450, "variant": "big" },
    { "at_px": 420, "type": "meteorite", "x": 342, "variant": "medium" },
    { "at_px": 420, "type": "meteorite", "x": 455, "variant": "medium" },
    { "at_px": 430, "type": "meteorite", "x": 178, "variant": "small" },
    { "at_px": 470, "type": "meteorite", "x": 411, "variant": "medium" },
    { "at_px": 480, "type": "meteorite", "x": 383, "variant": "small" },
    { "at_px": 520, "type": "meteorite", "x": 520, "variant": "medium" },
    { "at_px": 640, "type": "meteorite", "x": 315, "variant": "small" },
    { "at_px": 660, "type": "meteorite", "x": 423, "variant": "big" },
    { "at_px": 660, "type": "coin", "x": 192, "y": 0, "variant": "rare" },
    { "at_px": 710, "type": "meteorite", "x": 111, "variant": "medium" },
    { "at_px": 720, "type": "meteorite", "x": 340, "variant": "big" },
    { "at_px": 740, "type": "meteorite", "x": 232, "variant": "small" },
    { "at_px": 770, "type": "meteorite", "x": 230, "variant": "big" },
    { "at_px": 810, "type": "meteorite", "x": 159, "variant": "big" },
    { "at_px": 840, "type": "meteorite", "x": 130, "variant": "small" },
    { "at_px": 860, "type": "meteorite", "x": 142, "variant": "small" },
    { "at_px": 909, "type": "meteorite", "x": 205, "variant": "small" },
    { "at_px": 950, "type": "meteorite", "x": 33, "variant": "small" },
    { "at_px": 960, "type": "meteorite", "x": 343, "variant": "small" },
    { "at_px": 990, "type": "meteorite", "x": 324, "variant": "big" },
    { "at_px": 1080, "type": "meteorite", "x": 475, "variant": "big" }
  ]
}
